{
  "evaluationHash": "48404830413392c6bacca32ca26a40730914bfc1699375aba247cc199cf00263",
  "kind": "compute_program_gpu_activity",
  "policyHash": "c73779df2451e6520e244fbb5e53726f041af1e971a9a133128acdf3a76bae05",
  "schemaVersion": 1,
  "scope": "readable-clients-at-process-boundaries",
  "snapshots": [
    {
      "fdinfo": [
        {
          "contents": "pos:\t0\nflags:\t02104002\nmnt_id:\t1005\nino:\t1278\ndrm-driver:\tamdgpu\ndrm-client-id:\t52\ndrm-pdev:\t0000:c2:00.0\npasid:\t50\ndrm-total-cpu:\t0\ndrm-shared-cpu:\t0\ndrm-resident-cpu:\t0\ndrm-purgeable-cpu:\t0\ndrm-total-gtt:\t22548 KiB\ndrm-shared-gtt:\t0\ndrm-resident-gtt:\t110364 KiB\ndrm-purgeable-gtt:\t2816 KiB\ndrm-total-vram:\t248956 KiB\ndrm-shared-vram:\t0\ndrm-resident-vram:\t163956 KiB\ndrm-purgeable-vram:\t2816 KiB\ndrm-total-gds:\t0\ndrm-shared-gds:\t0\ndrm-resident-gds:\t0\ndrm-purgeable-gds:\t0\ndrm-total-gws:\t0\ndrm-shared-gws:\t0\ndrm-resident-gws:\t0\ndrm-purgeable-gws:\t0\ndrm-total-oa:\t0\ndrm-shared-oa:\t0\ndrm-resident-oa:\t0\ndrm-purgeable-oa:\t0\ndrm-total-doorbell:\t0\ndrm-shared-doorbell:\t0\ndrm-resident-doorbell:\t0\ndrm-purgeable-doorbell:\t0\ndrm-total-mmioremap:\t0\ndrm-shared-mmioremap:\t0\ndrm-resident-mmioremap:\t0\ndrm-purgeable-mmioremap:\t0\ndrm-memory-vram:\t163956 KiB\ndrm-memory-gtt: \t110364 KiB\ndrm-memory-cpu: \t0 KiB\namd-evicted-vram:\t0 KiB\namd-requested-vram:\t248956 KiB\namd-requested-gtt:\t22548 KiB\ndrm-engine-gfx:\t1331331068 ns\ndrm-engine-compute:\t43876980 ns\n",
          "fd": 12,
          "pid": 14297
        },
        {
          "contents": "pos:\t0\nflags:\t02104002\nmnt_id:\t1005\nino:\t1278\ndrm-driver:\tamdgpu\ndrm-client-id:\t52\ndrm-pdev:\t0000:c2:00.0\npasid:\t50\ndrm-total-cpu:\t0\ndrm-shared-cpu:\t0\ndrm-resident-cpu:\t0\ndrm-purgeable-cpu:\t0\ndrm-total-gtt:\t22548 KiB\ndrm-shared-gtt:\t0\ndrm-resident-gtt:\t110364 KiB\ndrm-purgeable-gtt:\t2816 KiB\ndrm-total-vram:\t248956 KiB\ndrm-shared-vram:\t0\ndrm-resident-vram:\t163956 KiB\ndrm-purgeable-vram:\t2816 KiB\ndrm-total-gds:\t0\ndrm-shared-gds:\t0\ndrm-resident-gds:\t0\ndrm-purgeable-gds:\t0\ndrm-total-gws:\t0\ndrm-shared-gws:\t0\ndrm-resident-gws:\t0\ndrm-purgeable-gws:\t0\ndrm-total-oa:\t0\ndrm-shared-oa:\t0\ndrm-resident-oa:\t0\ndrm-purgeable-oa:\t0\ndrm-total-doorbell:\t0\ndrm-shared-doorbell:\t0\ndrm-resident-doorbell:\t0\ndrm-purgeable-doorbell:\t0\ndrm-total-mmioremap:\t0\ndrm-shared-mmioremap:\t0\ndrm-resident-mmioremap:\t0\ndrm-purgeable-mmioremap:\t0\ndrm-memory-vram:\t163956 KiB\ndrm-memory-gtt: \t110364 KiB\ndrm-memory-cpu: \t0 KiB\namd-evicted-vram:\t0 KiB\namd-requested-vram:\t248956 KiB\namd-requested-gtt:\t22548 KiB\ndrm-engine-gfx:\t1331331068 ns\ndrm-engine-compute:\t43876980 ns\n",
          "fd": 13,
          "pid": 14297
        },
        {
          "contents": "pos:\t0\nflags:\t02104002\nmnt_id:\t1005\nino:\t1278\ndrm-driver:\tamdgpu\ndrm-client-id:\t52\ndrm-pdev:\t0000:c2:00.0\npasid:\t50\ndrm-total-cpu:\t0\ndrm-shared-cpu:\t0\ndrm-resident-cpu:\t0\ndrm-purgeable-cpu:\t0\ndrm-total-gtt:\t22548 KiB\ndrm-shared-gtt:\t0\ndrm-resident-gtt:\t110364 KiB\ndrm-purgeable-gtt:\t2816 KiB\ndrm-total-vram:\t248956 KiB\ndrm-shared-vram:\t0\ndrm-resident-vram:\t163956 KiB\ndrm-purgeable-vram:\t2816 KiB\ndrm-total-gds:\t0\ndrm-shared-gds:\t0\ndrm-resident-gds:\t0\ndrm-purgeable-gds:\t0\ndrm-total-gws:\t0\ndrm-shared-gws:\t0\ndrm-resident-gws:\t0\ndrm-purgeable-gws:\t0\ndrm-total-oa:\t0\ndrm-shared-oa:\t0\ndrm-resident-oa:\t0\ndrm-purgeable-oa:\t0\ndrm-total-doorbell:\t0\ndrm-shared-doorbell:\t0\ndrm-resident-doorbell:\t0\ndrm-purgeable-doorbell:\t0\ndrm-total-mmioremap:\t0\ndrm-shared-mmioremap:\t0\ndrm-resident-mmioremap:\t0\ndrm-purgeable-mmioremap:\t0\ndrm-memory-vram:\t163956 KiB\ndrm-memory-gtt: \t110364 KiB\ndrm-memory-cpu: \t0 KiB\namd-evicted-vram:\t0 KiB\namd-requested-vram:\t248956 KiB\namd-requested-gtt:\t22548 KiB\ndrm-engine-gfx:\t1331331068 ns\ndrm-engine-compute:\t43876980 ns\n",
          "fd": 14,
          "pid": 14297
        },
        {
          "contents": "pos:\t0\nflags:\t02104002\nmnt_id:\t1005\nino:\t1278\ndrm-driver:\tamdgpu\ndrm-client-id:\t52\ndrm-pdev:\t0000:c2:00.0\npasid:\t50\ndrm-total-cpu:\t0\ndrm-shared-cpu:\t0\ndrm-resident-cpu:\t0\ndrm-purgeable-cpu:\t0\ndrm-total-gtt:\t22548 KiB\ndrm-shared-gtt:\t0\ndrm-resident-gtt:\t110364 KiB\ndrm-purgeable-gtt:\t2816 KiB\ndrm-total-vram:\t248956 KiB\ndrm-shared-vram:\t0\ndrm-resident-vram:\t163956 KiB\ndrm-purgeable-vram:\t2816 KiB\ndrm-total-gds:\t0\ndrm-shared-gds:\t0\ndrm-resident-gds:\t0\ndrm-purgeable-gds:\t0\ndrm-total-gws:\t0\ndrm-shared-gws:\t0\ndrm-resident-gws:\t0\ndrm-purgeable-gws:\t0\ndrm-total-oa:\t0\ndrm-shared-oa:\t0\ndrm-resident-oa:\t0\ndrm-purgeable-oa:\t0\ndrm-total-doorbell:\t0\ndrm-shared-doorbell:\t0\ndrm-resident-doorbell:\t0\ndrm-purgeable-doorbell:\t0\ndrm-total-mmioremap:\t0\ndrm-shared-mmioremap:\t0\ndrm-resident-mmioremap:\t0\ndrm-purgeable-mmioremap:\t0\ndrm-memory-vram:\t163956 KiB\ndrm-memory-gtt: \t110364 KiB\ndrm-memory-cpu: \t0 KiB\namd-evicted-vram:\t0 KiB\namd-requested-vram:\t248956 KiB\namd-requested-gtt:\t22548 KiB\ndrm-engine-gfx:\t1331331068 ns\ndrm-engine-compute:\t43876980 ns\n",
          "fd": 15,
          "pid": 14297
        },
        {
          "contents": "pos:\t0\nflags:\t02100002\nmnt_id:\t30\nino:\t1277\ndrm-driver:\tamdgpu\ndrm-client-id:\t53\ndrm-pdev:\t0000:c2:00.0\npasid:\t51\ndrm-total-cpu:\t0\ndrm-shared-cpu:\t0\ndrm-resident-cpu:\t0\ndrm-purgeable-cpu:\t0\ndrm-total-gtt:\t2 MiB\ndrm-shared-gtt:\t0\ndrm-resident-gtt:\t2 MiB\ndrm-purgeable-gtt:\t0\ndrm-total-vram:\t12 KiB\ndrm-shared-vram:\t0\ndrm-resident-vram:\t12 KiB\ndrm-purgeable-vram:\t0\ndrm-total-gds:\t0\ndrm-shared-gds:\t0\ndrm-resident-gds:\t0\ndrm-purgeable-gds:\t0\ndrm-total-gws:\t0\ndrm-shared-gws:\t0\ndrm-resident-gws:\t0\ndrm-purgeable-gws:\t0\ndrm-total-oa:\t0\ndrm-shared-oa:\t0\ndrm-resident-oa:\t0\ndrm-purgeable-oa:\t0\ndrm-total-doorbell:\t0\ndrm-shared-doorbell:\t0\ndrm-resident-doorbell:\t0\ndrm-purgeable-doorbell:\t0\ndrm-total-mmioremap:\t0\ndrm-shared-mmioremap:\t0\ndrm-resident-mmioremap:\t0\ndrm-purgeable-mmioremap:\t0\ndrm-memory-vram:\t12 KiB\ndrm-memory-gtt: \t2048 KiB\ndrm-memory-cpu: \t0 KiB\namd-evicted-vram:\t0 KiB\namd-requested-vram:\t12 KiB\namd-requested-gtt:\t2048 KiB\n",
          "fd": 37,
          "pid": 14297
        },
        {
          "contents": "pos:\t0\nflags:\t02100002\nmnt_id:\t30\nino:\t1277\ndrm-driver:\tamdgpu\ndrm-client-id:\t62\ndrm-pdev:\t0000:c2:00.0\npasid:\t60\ndrm-total-cpu:\t0\ndrm-shared-cpu:\t0\ndrm-resident-cpu:\t0\ndrm-purgeable-cpu:\t0\ndrm-total-gtt:\t10256 KiB\ndrm-shared-gtt:\t0\ndrm-resident-gtt:\t18584 KiB\ndrm-purgeable-gtt:\t0\ndrm-total-vram:\t11176 KiB\ndrm-shared-vram:\t0\ndrm-resident-vram:\t2848 KiB\ndrm-purgeable-vram:\t2816 KiB\ndrm-total-gds:\t0\ndrm-shared-gds:\t0\ndrm-resident-gds:\t0\ndrm-purgeable-gds:\t0\ndrm-total-gws:\t0\ndrm-shared-gws:\t0\ndrm-resident-gws:\t0\ndrm-purgeable-gws:\t0\ndrm-total-oa:\t0\ndrm-shared-oa:\t0\ndrm-resident-oa:\t0\ndrm-purgeable-oa:\t0\ndrm-total-doorbell:\t0\ndrm-shared-doorbell:\t0\ndrm-resident-doorbell:\t0\ndrm-purgeable-doorbell:\t0\ndrm-total-mmioremap:\t0\ndrm-shared-mmioremap:\t0\ndrm-resident-mmioremap:\t0\ndrm-purgeable-mmioremap:\t0\ndrm-memory-vram:\t2848 KiB\ndrm-memory-gtt: \t18584 KiB\ndrm-memory-cpu: \t0 KiB\namd-evicted-vram:\t0 KiB\namd-requested-vram:\t11176 KiB\namd-requested-gtt:\t10256 KiB\ndrm-engine-gfx:\t111792 ns\ndrm-engine-compute:\t65304 ns\n",
          "fd": 9,
          "pid": 14839
        },
        {
          "contents": "pos:\t0\nflags:\t02100002\nmnt_id:\t30\nino:\t1277\ndrm-driver:\tamdgpu\ndrm-client-id:\t62\ndrm-pdev:\t0000:c2:00.0\npasid:\t60\ndrm-total-cpu:\t0\ndrm-shared-cpu:\t0\ndrm-resident-cpu:\t0\ndrm-purgeable-cpu:\t0\ndrm-total-gtt:\t10256 KiB\ndrm-shared-gtt:\t0\ndrm-resident-gtt:\t18584 KiB\ndrm-purgeable-gtt:\t0\ndrm-total-vram:\t11176 KiB\ndrm-shared-vram:\t0\ndrm-resident-vram:\t2848 KiB\ndrm-purgeable-vram:\t2816 KiB\ndrm-total-gds:\t0\ndrm-shared-gds:\t0\ndrm-resident-gds:\t0\ndrm-purgeable-gds:\t0\ndrm-total-gws:\t0\ndrm-shared-gws:\t0\ndrm-resident-gws:\t0\ndrm-purgeable-gws:\t0\ndrm-total-oa:\t0\ndrm-shared-oa:\t0\ndrm-resident-oa:\t0\ndrm-purgeable-oa:\t0\ndrm-total-doorbell:\t0\ndrm-shared-doorbell:\t0\ndrm-resident-doorbell:\t0\ndrm-purgeable-doorbell:\t0\ndrm-total-mmioremap:\t0\ndrm-shared-mmioremap:\t0\ndrm-resident-mmioremap:\t0\ndrm-purgeable-mmioremap:\t0\ndrm-memory-vram:\t2848 KiB\ndrm-memory-gtt: \t18584 KiB\ndrm-memory-cpu: \t0 KiB\namd-evicted-vram:\t0 KiB\namd-requested-vram:\t11176 KiB\namd-requested-gtt:\t10256 KiB\ndrm-engine-gfx:\t111792 ns\ndrm-engine-compute:\t65304 ns\n",
          "fd": 10,
          "pid": 14839
        },
        {
          "contents": "pos:\t0\nflags:\t02100002\nmnt_id:\t30\nino:\t1277\ndrm-driver:\tamdgpu\ndrm-client-id:\t62\ndrm-pdev:\t0000:c2:00.0\npasid:\t60\ndrm-total-cpu:\t0\ndrm-shared-cpu:\t0\ndrm-resident-cpu:\t0\ndrm-purgeable-cpu:\t0\ndrm-total-gtt:\t10256 KiB\ndrm-shared-gtt:\t0\ndrm-resident-gtt:\t18584 KiB\ndrm-purgeable-gtt:\t0\ndrm-total-vram:\t11176 KiB\ndrm-shared-vram:\t0\ndrm-resident-vram:\t2848 KiB\ndrm-purgeable-vram:\t2816 KiB\ndrm-total-gds:\t0\ndrm-shared-gds:\t0\ndrm-resident-gds:\t0\ndrm-purgeable-gds:\t0\ndrm-total-gws:\t0\ndrm-shared-gws:\t0\ndrm-resident-gws:\t0\ndrm-purgeable-gws:\t0\ndrm-total-oa:\t0\ndrm-shared-oa:\t0\ndrm-resident-oa:\t0\ndrm-purgeable-oa:\t0\ndrm-total-doorbell:\t0\ndrm-shared-doorbell:\t0\ndrm-resident-doorbell:\t0\ndrm-purgeable-doorbell:\t0\ndrm-total-mmioremap:\t0\ndrm-shared-mmioremap:\t0\ndrm-resident-mmioremap:\t0\ndrm-purgeable-mmioremap:\t0\ndrm-memory-vram:\t2848 KiB\ndrm-memory-gtt: \t18584 KiB\ndrm-memory-cpu: \t0 KiB\namd-evicted-vram:\t0 KiB\namd-requested-vram:\t11176 KiB\namd-requested-gtt:\t10256 KiB\ndrm-engine-gfx:\t111792 ns\ndrm-engine-compute:\t65304 ns\n",
          "fd": 11,
          "pid": 14839
        },
        {